{"generated_at":"2026-09-11T17:58:23.769946+00:00","pipeline_version":"1.0.0","source_file_sha256":"955b49a7763f7a33691e5356bd33562c50f47904cf5e070c93e98a6641d6f913","source_rows_total":2023,"scope_regex":"^(D22CNPM|D22HTTT|E22)","n_in_scope":905,"n_with_cpa":903,"n_classes":18,"n_tracks":5,"n_programs":2,"cohort":{"2021":6,"2022":899},"min_group_size":10,"bootstrap":{"iterations":10000,"seed":42},"dictionaries":{"track":["D22CNPM","D22HTTT","E22CNPM","E22HTTT","E22TTNT"],"program":["CNTT","CNTT CLC"],"major":["DCAT","DCCI","DCCN","DCDK","DCDT","DCKH","DCVT"],"track_program":[0,0,1,1,1]}}